{
  "schema_version": "1.0.0",
  "id": "DOS-WP-2026-0001-G00-v1",
  "work_package_id": "WP-2026-0001",
  "gate": "G00",
  "policy_epoch": "BADF-2026-08-25",
  "source_revision": "BADF-BASELINE-1.0.0",
  "target": "badf-repository-baseline",
  "change_class": "C0",
  "evidence": [
    {
      "type": "authority",
      "path": "examples/evidence/G00/authority.json"
    },
    {
      "type": "scope",
      "path": "examples/evidence/G00/scope.json"
    },
    {
      "type": "risk-classification",
      "path": "examples/evidence/G00/risk-classification.json"
    }
  ],
  "approvals": [],
  "exceptions": [],
  "risks": [],
  "disposition": "PASS",
  "created_at": "2026-08-25T00:00:02Z",
  "author": "example-author"
}